{
  "contract": "TaskPlanLineage/v1",
  "delivery_plan_sha256": "d69e315761eecdd55e7c36a26552241a4a2785314ed6f56d0a3f7fc63ab95d76",
  "engine_version": "3.10.0",
  "intent": {
    "id": "DI-RATE-LIMIT",
    "sha256": "4254dde17e3a0ea801b3c85e1b28fd7a93b6485049ad6258b1bfb9ac915834ac"
  },
  "review": {
    "fixture": false,
    "plan_sha256": "d69e315761eecdd55e7c36a26552241a4a2785314ed6f56d0a3f7fc63ab95d76",
    "reviewed_at": "2026-09-15T11:19:30.726656+00:00",
    "reviewer": "fixture-controller",
    "sha256": "a20130926970a79a09fd8e3d8853d2cc7974beea56db7c2959f0122bdbc31fd4"
  },
  "task_plan": {
    "contract": "TaskPlan/v1",
    "digest": "01aa8d134f3c1165637360ecb438441a52f778f6907da9341fee1fb24d28a5c1",
    "path": "tasks/.plans/managed/task-plan.json"
  },
  "units": {
    "T-20260914-chat-output": {
      "intent": "DI-RATE-LIMIT",
      "leg": "LEG-POLICY-SCHEMA-VALID",
      "seam": "SEAM-POLICY-CONTRACT",
      "source_sha256": "476e968fc815208decf9315db9be16731953b4a39239c9a71f2f8959ad037761",
      "swimlane": "LANE-POLICY-CONTRACT",
      "unit_id": "T-20260914-chat-output"
    }
  }
}
