{
  "contract": "TaskPlanLineage/v1",
  "delivery_plan_sha256": "fc8f94690205b9554d4e4a264f01799760bdfde9cdcd0fd0b42887151057626f",
  "engine_version": "3.10.0",
  "intent": {
    "id": "DI-RATE-LIMIT",
    "sha256": "4254dde17e3a0ea801b3c85e1b28fd7a93b6485049ad6258b1bfb9ac915834ac"
  },
  "review": {
    "fixture": false,
    "plan_sha256": "fc8f94690205b9554d4e4a264f01799760bdfde9cdcd0fd0b42887151057626f",
    "reviewed_at": "2026-09-14T22:37:54.415017+00:00",
    "reviewer": "fixture-controller",
    "sha256": "3493b684964c98268e8bb58844cd95b1d61a033979dc76687142afce0a06ccb5"
  },
  "task_plan": {
    "contract": "TaskPlan/v1",
    "digest": "6e600ecac24fbfc065ef136180b91a6441a78b546f799b314024c58d71966442",
    "path": "tasks/.plans/managed/task-plan.json"
  },
  "units": {
    "T-20260914-chat-output": {
      "intent": "DI-RATE-LIMIT",
      "leg": "LEG-POLICY-SCHEMA-VALID",
      "seam": "SEAM-POLICY-CONTRACT",
      "source_sha256": "476e968fc815208decf9315db9be16731953b4a39239c9a71f2f8959ad037761",
      "swimlane": "LANE-POLICY-CONTRACT",
      "unit_id": "T-20260914-chat-output"
    }
  }
}
