{
  "contract": "TaskPlanLineage/v1",
  "delivery_plan_sha256": "907fded62937ad44b9d9b7b819e6f426e2ad7f00bc2d99b0440910286bb49077",
  "engine_version": "3.10.0",
  "intent": {
    "id": "DI-RATE-LIMIT",
    "sha256": "4254dde17e3a0ea801b3c85e1b28fd7a93b6485049ad6258b1bfb9ac915834ac"
  },
  "review": {
    "fixture": false,
    "plan_sha256": "907fded62937ad44b9d9b7b819e6f426e2ad7f00bc2d99b0440910286bb49077",
    "reviewed_at": "2026-09-14T21:40:50.522374+00:00",
    "reviewer": "fixture-controller",
    "sha256": "e27ee0d6ea50fcedcc10490bc0682cc6eb4d96a8dcf77fc0ed005729ce84ce2c"
  },
  "task_plan": {
    "contract": "TaskPlan/v1",
    "digest": "ad306dc4de91d7ec49d3027697cec444ca6800f8bc3ecff78250d6dec32a9503",
    "path": "tasks/.plans/managed/task-plan.json"
  },
  "units": {
    "T-20260914-chat-output": {
      "intent": "DI-RATE-LIMIT",
      "leg": "LEG-POLICY-SCHEMA-VALID",
      "seam": "SEAM-POLICY-CONTRACT",
      "source_sha256": "476e968fc815208decf9315db9be16731953b4a39239c9a71f2f8959ad037761",
      "swimlane": "LANE-POLICY-CONTRACT",
      "unit_id": "T-20260914-chat-output"
    }
  }
}
